{"approvals":[],"archived_source_path":"docs/evidence/governance/decision-history/archive/af67c861f93f9e79483bbd235bcb604824546247c4a8e68e8857d8c1541f7460--DECISIONS.md","archived_source_sha256":"af67c861f93f9e79483bbd235bcb604824546247c4a8e68e8857d8c1541f7460","authority_effect":"OBSERVED_MIGRATION_AND_UNAPPROVED_PROPOSALS_ONLY","history_revision":1,"migration_anchor":{"artifact_path":"docs/evidence/governance/decision-history/anchors/decision-history-anchor--0b43894e993a7f0ef4ca6e73e791b7a52b05905c7e0fb5318fb7b45577fe2f79.json","artifact_sha256":"0b43894e993a7f0ef4ca6e73e791b7a52b05905c7e0fb5318fb7b45577fe2f79","record_id":"decision-history-anchor-4f3c30ea7ad3a3a8f2fd85d9d47ef824157d9fd7c7439425316b9644558f9eb6"},"predecessor_head_artifact_sha256":null,"proposal_records":[{"artifact_path":"docs/evidence/governance/decision-history/proposals/D-028--21afd9d064eb8b6f3a30edcf93dde9936a868aeb07bb300594feb1f3251cf41b.json","artifact_sha256":"21afd9d064eb8b6f3a30edcf93dde9936a868aeb07bb300594feb1f3251cf41b","decision_id":"D-028","effective_status":"NOT_EFFECTIVE_PENDING_AUTHORIZED_ACCEPTANCE","proposal_block_sha256":"54bed2255665214c458c8e8484cb8c38fc6d078023f8b211ca1739625fbb68a3","proposal_status":"proposed","record_id":"decision-successor-proposal-D-028-54bed2255665214c458c8e8484cb8c38fc6d078023f8b211ca1739625fbb68a3"},{"artifact_path":"docs/evidence/governance/decision-history/proposals/D-029--7447f62c3b8bf5355e428c2ad80df30b805177810d8cc44208304a4ad265ffec.json","artifact_sha256":"7447f62c3b8bf5355e428c2ad80df30b805177810d8cc44208304a4ad265ffec","decision_id":"D-029","effective_status":"NOT_EFFECTIVE_PENDING_AUTHORIZED_ACCEPTANCE","proposal_block_sha256":"5438ff8dd3afb596fe45c9783f53d84f3442a0e04ac6c9d1172a270a5ac671e9","proposal_status":"proposed","record_id":"decision-successor-proposal-D-029-5438ff8dd3afb596fe45c9783f53d84f3442a0e04ac6c9d1172a270a5ac671e9"},{"artifact_path":"docs/evidence/governance/decision-history/proposals/D-030--9a510a13b398eaf637d021c4116f9cfd07dbd12292379df19e600241871f334a.json","artifact_sha256":"9a510a13b398eaf637d021c4116f9cfd07dbd12292379df19e600241871f334a","decision_id":"D-030","effective_status":"NOT_EFFECTIVE_PENDING_AUTHORIZED_ACCEPTANCE","proposal_block_sha256":"df39cf1b8b73224db5e91ce2a9b3df5be6bb63c429ed6f2af1f18ec448189395","proposal_status":"proposed","record_id":"decision-successor-proposal-D-030-df39cf1b8b73224db5e91ce2a9b3df5be6bb63c429ed6f2af1f18ec448189395"}],"publication_order_kind":"APPEND_ORDER_NOT_SEMANTIC_SUCCESSOR_CHAIN","publication_semantics":{"addressed_bytes":"RECORD_RAW_BYTES","mutation":"FORBIDDEN","on_existing_path":"REQUIRE_EXACT_RECORD_BYTES","write_mode":"CREATE_IF_ABSENT"},"record_id":"decision-history-head-v1-af67c861f93f9e79483bbd235bcb604824546247c4a8e68e8857d8c1541f7460","schema":"ylx.decision-history-head.v1","selector_version":"decision-history-selector.v1","source_artifact_path":"docs/DECISIONS.md","source_publication_prefix":{"byte_length":71180,"end_byte":71180,"sha256":"af67c861f93f9e79483bbd235bcb604824546247c4a8e68e8857d8c1541f7460","start_byte":0}}